{
  "schemaVersion": "1.0",
  "projectName": "CVF-Operations-Workspace",
  "description": "Machine source for documentation discovery, authority, lifecycle status, and generated docs/INDEX.md.",
  "artifactTypes": {
    "continuity": "Canonical session and handoff state.",
    "implementation_truth": "Machine-readable current implementation claim boundary.",
    "catalog": "Registry and catalog governance surface.",
    "decision": "Accepted or proposed architecture/product decision.",
    "roadmap": "Ordered intended delivery plan, not implementation truth.",
    "specification": "Testable requirements for a bounded tranche.",
    "work_order": "Authority, scope ceiling, evidence, roles and stop conditions.",
    "review": "Assessment, review or evidence receipt.",
    "guide": "Operator or contributor guidance."
  },
  "statusLegend": {
    "active": "Current authoritative or active artifact.",
    "awaiting_authorization": "Authored but not authorized for BUILD.",
    "reference": "Useful input that is not current authority.",
    "generated": "Generated from a machine source; do not hand-edit.",
    "historical": "Retained history; not current authority.",
    "superseded": "Replaced by a named successor."
  },
  "artifacts": [
    {
      "id": "session-memory",
      "title": "Project Session Memory",
      "path": "CVF_SESSION_MEMORY.md",
      "type": "continuity",
      "status": "active",
      "authority": "canonical_pointer",
      "entrypoint": true,
      "summary": "Startup order and canonical continuity pointer.",
      "related": ["active-session-state", "active-handoff"]
    },
    {
      "id": "active-session-state",
      "title": "Active Session State",
      "path": "CVF_SESSION/ACTIVE_SESSION_STATE.json",
      "type": "continuity",
      "status": "active",
      "authority": "canonical_machine",
      "entrypoint": true,
      "summary": "Current phase, role, next move and parked checkpoint.",
      "related": ["active-handoff"]
    },
    {
      "id": "active-handoff",
      "title": "Active Agent Handoff",
      "path": "CVF_SESSION/handoffs/AGENT_HANDOFF_V1_2026-07-23.md",
      "type": "continuity",
      "status": "active",
      "authority": "canonical",
      "entrypoint": true,
      "summary": "Human-readable current state and claim boundary.",
      "related": ["active-session-state"]
    },
    {
      "id": "implementation-status",
      "title": "Implementation Status",
      "path": "IMPLEMENTATION_STATUS.json",
      "type": "implementation_truth",
      "status": "active",
      "authority": "canonical_machine",
      "entrypoint": true,
      "summary": "Current implemented capabilities, limitations and active work orders.",
      "related": ["module-registry"]
    },
    {
      "id": "artifact-registry",
      "title": "Artifact Registry",
      "path": "docs/catalog/ARTIFACT_REGISTRY.json",
      "type": "catalog",
      "status": "active",
      "authority": "canonical_machine",
      "entrypoint": true,
      "summary": "Machine source for documentation discovery and generated Index.",
      "related": ["artifact-registry-schema", "catalog-standard", "catalog-tool"]
    },
    {
      "id": "artifact-registry-schema",
      "title": "Artifact Registry Schema",
      "path": "docs/catalog/ARTIFACT_REGISTRY.schema.json",
      "type": "catalog",
      "status": "active",
      "authority": "canonical_contract",
      "entrypoint": false,
      "summary": "JSON Schema contract for Artifact Registry records.",
      "related": ["artifact-registry"]
    },
    {
      "id": "module-registry",
      "title": "Module Registry",
      "path": "docs/catalog/MODULE_REGISTRY.json",
      "type": "catalog",
      "status": "active",
      "authority": "canonical_machine",
      "entrypoint": true,
      "summary": "Machine source for source-backed module claims.",
      "related": ["module-catalog", "module-registry-schema", "catalog-standard", "catalog-tool"]
    },
    {
      "id": "module-registry-schema",
      "title": "Module Registry Schema",
      "path": "docs/catalog/MODULE_REGISTRY.schema.json",
      "type": "catalog",
      "status": "active",
      "authority": "canonical_contract",
      "entrypoint": false,
      "summary": "JSON Schema contract for source-backed module records.",
      "related": ["module-registry"]
    },
    {
      "id": "module-catalog",
      "title": "Module Catalog",
      "path": "docs/catalog/MODULE_CATALOG.md",
      "type": "catalog",
      "status": "generated",
      "authority": "generated",
      "entrypoint": true,
      "summary": "Generated human view of the Module Registry.",
      "related": ["module-registry"]
    },
    {
      "id": "catalog-standard",
      "title": "Index and Catalog Governance",
      "path": "docs/catalog/README.md",
      "type": "guide",
      "status": "active",
      "authority": "canonical",
      "entrypoint": true,
      "summary": "Registry maintenance, generation and claim-boundary rules.",
      "related": ["artifact-registry", "module-registry", "catalog-tool", "catalog-tests", "adr-index-catalog"]
    },
    {
      "id": "catalog-tool",
      "title": "Index and Catalog Manager",
      "path": "scripts/manage_catalog.py",
      "type": "guide",
      "status": "active",
      "authority": "executable_control",
      "entrypoint": false,
      "summary": "Validates registries, computes metrics and generates both human views.",
      "related": ["artifact-registry", "module-registry", "catalog-tests"]
    },
    {
      "id": "catalog-tests",
      "title": "Index and Catalog Management Tests",
      "path": "tests/test_catalog_management.py",
      "type": "review",
      "status": "active",
      "authority": "executable_evidence",
      "entrypoint": false,
      "summary": "Positive, negative and generated-drift checks for registry governance.",
      "related": ["catalog-tool"]
    },
    {
      "id": "assessment-reconciliation",
      "title": "Assessment Reconciliation",
      "path": "docs/reviews/ASSESSMENT_RECONCILIATION_2026-07-23.md",
      "type": "review",
      "status": "active",
      "authority": "reviewed_input",
      "entrypoint": false,
      "summary": "Reconciles the old rename assessment with the greenfield decision.",
      "related": ["adr-greenfield"]
    },
    {
      "id": "adr-greenfield",
      "title": "Greenfield Platform and Governed Profile Porting",
      "path": "docs/decisions/ADR_2026-07-23_GREENFIELD_PLATFORM_AND_PROFILE_PORTING.md",
      "type": "decision",
      "status": "active",
      "authority": "accepted_for_planning",
      "entrypoint": false,
      "summary": "Defines platform/profile ownership and per-asset porting.",
      "related": ["platform-roadmap", "f0-spec"]
    },
    {
      "id": "adr-index-catalog",
      "title": "Machine-Governed Documentation Index and Module Catalog",
      "path": "docs/decisions/ADR_2026-07-23_INDEX_CATALOG_GOVERNANCE.md",
      "type": "decision",
      "status": "active",
      "authority": "accepted",
      "entrypoint": false,
      "summary": "Separates documentation discovery from implementation claims.",
      "related": ["catalog-standard", "g1-spec"]
    },
    {
      "id": "platform-roadmap",
      "title": "CVF Operations Workspace Roadmap",
      "path": "docs/roadmaps/CVF_OPERATIONS_WORKSPACE_ROADMAP.md",
      "type": "roadmap",
      "status": "active",
      "authority": "canonical",
      "entrypoint": false,
      "summary": "Greenfield delivery sequence G0 and F0 through F7.",
      "related": ["adr-greenfield", "f0-spec"]
    },
    {
      "id": "f0-spec",
      "title": "F0 Source Intake and Compatibility Baseline Specification",
      "path": "docs/specs/F0_SOURCE_INTAKE_AND_COMPATIBILITY_BASELINE_SPEC.md",
      "type": "specification",
      "status": "historical",
      "authority": "frozen_spec",
      "entrypoint": false,
      "summary": "Requirements for reproducible source intake without runtime import.",
      "related": ["f0-work-order", "f0-work-order-amendment-1", "platform-roadmap"]
    },
    {
      "id": "f0-work-order",
      "title": "F0 Source Intake and Compatibility Baseline Work Order",
      "path": "docs/work_orders/F0_SOURCE_INTAKE_AND_COMPATIBILITY_BASELINE_WORK_ORDER.md",
      "type": "work_order",
      "status": "historical",
      "authority": "closed",
      "entrypoint": false,
      "summary": "Authorized bounded F0 source-intake work order.",
      "related": ["f0-spec", "f0-work-order-amendment-1"]
    },
    {
      "id": "f0-work-order-amendment-1",
      "title": "F0 Work Order Amendment 1 — Index/Catalog Integration",
      "path": "docs/work_orders/F0_SOURCE_INTAKE_AND_COMPATIBILITY_BASELINE_WORK_ORDER_AMENDMENT_1.md",
      "type": "work_order",
      "status": "historical",
      "authority": "closed_amendment",
      "entrypoint": false,
      "summary": "Requires Artifact Registry updates and generated Index while excluding Module Registry.",
      "related": ["f0-spec", "f0-work-order"]
    },
    {
      "id": "g1-spec",
      "title": "G1 Index and Catalog Governance Specification",
      "path": "docs/specs/G1_INDEX_CATALOG_GOVERNANCE_SPEC.md",
      "type": "specification",
      "status": "historical",
      "authority": "frozen_spec",
      "entrypoint": false,
      "summary": "Requirements for schema-backed registries and drift checks.",
      "related": ["g1-work-order", "adr-index-catalog"]
    },
    {
      "id": "g1-work-order",
      "title": "G1 Index and Catalog Governance Work Order",
      "path": "docs/work_orders/G1_INDEX_CATALOG_GOVERNANCE_WORK_ORDER.md",
      "type": "work_order",
      "status": "historical",
      "authority": "closed",
      "entrypoint": false,
      "summary": "Authorized R1 changed-set ceiling for Index/Catalog governance.",
      "related": ["g1-spec", "g1-work-order-amendment-1"]
    },
    {
      "id": "g1-work-order-amendment-1",